1,110 in the Shade,1963,Broadway,Harvey Schmidt,Tom Jones,N. Richard Nash,"Based on Nash's 1954 play, The Rainmaker.",https://en.wikipedia.org/wiki/110_in_the_Shade
2,13,2008,Broadway,Jason Robert Brown,Brown,Dan Elish and Horn,,https://en.wikipedia.org/wiki/13_(musical)
3,1492 Up To Date,1893,Broadway,Carl Pflueger,R. A. Barnet,Barnet,A burlesque show.,https://en.wikipedia.org/wiki/1492_Up_To_Date
4,1600 Pennsylvania Avenue,1976,Broadway,Leonard Bernstein,Alan Jay Lerner,Lerner,Ran for only 7 performances.,https://en.wikipedia.org/wiki/1600_Pennsylvania_Avenue_(musical)
5,1776,1969,Broadway,Sherman Edwards,Edwards,Peter Stone,,https://en.wikipedia.org/wiki/1776_(musical)
6,1789: Les Amants de la Bastille,2012,French musical,"Rod Janois, Jean-Pierre Pilot, Olivier Schultheis, William Rousseau and Dove Attia",Attia and Vincent Baguian,Attia and François Chouquet,Based on the French Revolution,https://en.wikipedia.org/wiki/1789:_Les_Amants_de_la_Bastille
7,The 25th Annual Putnam County Spelling Bee,2005,Broadway,William Finn,Finn,Rachel Sheinkin,,https://en.wikipedia.org/wiki/The_25th_Annual_Putnam_County_Spelling_Bee
8,35MM: A Musical Exhibition,2012,Off-Broadway,Ryan Scott Oliver,Oliver,N/A,,
9,3 Musketiers,2003,Dutch musical,"Ferdi Bolland, Rob Bolland, and Paul Bogaev",Bolland and Bolland,André Breedland,,https://en.wikipedia.org/wiki/3_Musketiers
10,3hree,2001,Off-Off-Broadway,"Laurence O'Keefe, Neil Dunbar Benjamin, Robert Lindsey Nassif and John Bucchino","O'Keefe, Benjamin, Nassif and Bucchino","O'Keefe, Benjamin, Nassif and Bucchino","Three One-act musical combined, The Mice, The Flight of the Lawnchair Man and Lavender Girl.",
11,42nd Street,1980,Broadway,Harry Warren,Al Dubin,Michael Stewart and Mark Bramble,Based on Bradford Ropes' novel.,https://en.wikipedia.org/wiki/42nd_Street_(musical)
12,"70, Girls, 70",1971,Broadway,John Kander,Fred Ebb,Ebb and Norman L. Martin,Based on the 1958 play Breath of Spring by Peter Coke.,
13,8 femmes,2002,Musical film,Various artists,Various artists,François Ozon and Marina de Van,Bases on the play by Robert Thomas.,https://en.wikipedia.org/wiki/8_Women
14,9 to 5,2009,Broadway,Dolly Parton,Dolly Parton,Patricia Resnick,Based on the 1980 film.,https://en.wikipedia.org/wiki/9_to_5_(musical)
15,"A... My Name Is Alice and
A... My Name Will Always Be Alice",1984,Off-Broadway revue,"David Zippel, Winnie Holzman and Lucy Simon","Zippel, Holzman and Simon",Joan Micklin Silver and Julianne Boyd,,https://en.wikipedia.org/wiki/A..._My_Name_Is_Alice
16,A Christmas Story: The Musical,2012,Broadway,Benj Pasek and Justin Paul,Pasek and Paul,Joseph Robinette,,https://en.wikipedia.org/wiki/A_Christmas_Story:_The_Musical
17,A Dangerous Maid,1923,Broadway,George Gershwin,Ira Gershwin,Charles W. Bell,"Based on Bell's 1918 play, A Dislocated Honeymoon.",https://en.wikipedia.org/wiki/A_Dangerous_Maid
18,A Family Affair,1962,Broadway,John Kander,James Goldman and William Goldman,Goldman and Goldman,,https://en.wikipedia.org/wiki/A_Family_Affair_(musical)
19,A Hatful of Snow,1994,Holiday Musical,Matthew Breindel,Breindel,Breindel,,
20,A Little Princess,2003,Off-Broadway,Andrew Lippa,Brian Crawley,Brian Crawley,,https://en.wikipedia.org/wiki/A_Little_Princess_(Lippa_musical)
21,A Minister's Wife,2011,Off-Broadway,Joshua Schmidt,Jan Tranen,Austin Pendleton,Based on George Bernard Shaw's Candida.,
22,A New Brain,1998,Off-Broadway,William Finn,Finn,Finn and James Lapine,,https://en.wikipedia.org/wiki/A_New_Brain
23,A Tale of Two Cities,2008,Broadway,Jill Santoriello,Santoriello,Santoriello,,https://en.wikipedia.org/wiki/A_Tale_of_Two_Cities_(musical)
24,A Very Potter Musical,2009,Off-Off-Broadway,A.J. Holmes and Darren Criss,Holmes and Criss,"Matt Lang, Nick Lang and Brian Holden",Performed by StarKid Productions.,https://en.wikipedia.org/wiki/A_Very_Potter_Musical
25,A Very Potter Sequel,2010,Off-Off-Broadway,Darren Criss,Criss,"Matt Lang, Nick Lang and Brian Holden",Performed by StarKid Productions.,https://en.wikipedia.org/wiki/A_Very_Potter_Sequel
26,A Very Potter Senior Year,2012,Off-Off-Broadway,"A.J. Holmes, Clark Baxtresser, Pierce Siebers and Darren Criss","Holmes, Baxtresser, Siebers and Criss","Matt Lang, Nick Lang and Brian Holden",Performed by StarKid Productions.,https://en.wikipedia.org/wiki/A_Very_Potter_Senior_Year
27,Aaron Slick from Punkin Crick,1952,Musical film,Ray Evans and Jay Livingston,Evans and Livingston,Claude Binyon,,https://en.wikipedia.org/wiki/Aaron_Slick_from_Punkin_Crick
28,Abbacadabra,1983,French musical,Benny Andersson and Björn Ulvaeus,Alain Boublil and Daniel Boublil,N/A,,https://en.wikipedia.org/wiki/Abbacadabra
29,About Face,1952,Musical film,Peter DeRose et al,de Rose et al,Peter Milne,,https://en.wikipedia.org/wiki/About_Face_(1952_film)
30,About Town,1906,Broadway,Melville Ellis and Raymond Hubbell,Joseph Herbert,Herbert,,
31,Absolute Beginners,1986,Musical film,Gil Evans and various artists,Evans and various artists,Richard Burridge,,https://en.wikipedia.org/wiki/Absolute_Beginners_(film)
32,Abyssinia,1987,Broadway,Ted Kociolek,James Racheff,Racheff and Kociolek,"Based on the novel Marked by Fire, by Joyce Carol Thomas.",https://en.wikipedia.org/wiki/Abyssinia_(musical)
33,Ace,2006,Off-Off-Broadway,Richard Oberacker,Robert Taylor and Oberacker,Taylor and Oberacker,,https://en.wikipedia.org/wiki/Ace_(musical)
34,Ace of Clubs,1950,West End,Noël Coward,Coward,Coward,,https://en.wikipedia.org/wiki/Ace_of_Clubs_(musical)
35,Acorn Antiques: The Musical!,2005,West End,Victoria Wood,Wood,Wood,,https://en.wikipedia.org/wiki/Acorn_Antiques:_The_Musical!
36,Across the Universe,2007,Musical film,The Beatles,The Beatles,Julie Taymor,,https://en.wikipedia.org/wiki/Across_the_Universe_(film)
37,The Act,1977,Broadway,John Kander,Fred Ebb,George Furth,,https://en.wikipedia.org/wiki/The_Act_(musical)
38,The Addams Family,"2010
","Broadway
Touring UK
",Andrew Lippa,Lippa,Marshall Brickman and Rick Elice,,https://en.wikipedia.org/wiki/The_Addams_Family_(musical)
39,Adding Machine,2008,Off-Broadway,Joshua Schmidt,Jason Loewith and Schmidt,Loewith and Schmidt,,https://en.wikipedia.org/wiki/Adding_Machine_(musical)
40,Adèle,1913,Broadway,Jean Briquet and Adolf Phillipp,Paul Hervé,Hervé,English adaptation by Philipp and Edward A. Paulton.,https://en.wikipedia.org/wiki/Adele_(musical)
41,Adonis,1884,Broadway,Edward E. Rice and John Eller,Rice and Eller,William Gill,,https://en.wikipedia.org/wiki/Adonis_(musical)
42,"The Adventures of Priscilla, Queen of the Desert",1994,Musical film,Guy Cross and various artists,Various artists,Stephan Elliott,,https://en.wikipedia.org/wiki/Priscilla_Queen_of_the_Desert_(musical)
43,The Adventures of Tom Sawyer,2001,Broadway,Don Schlitz,Schlitz,Ken Ludwig,,https://en.wikipedia.org/wiki/The_Adventures_of_Tom_Sawyer_(musical)
44,Affair in Trinidad,1952,Musical film,Lester Lee and Bob Russell et al.,Lee and Russell et al.,Berne Giler and James Gunn,,https://en.wikipedia.org/wiki/Affair_in_Trinidad
45,The Affairs of Dobie Gillis,1953,Musical film,Various Artists,Various Artists,Max Shulman,,https://en.wikipedia.org/wiki/The_Affairs_of_Dobie_Gillis
46,Afgar,1919,West End,Charles Cuvillier,Douglas Furber,Fred Thompson and Worton David,,https://en.wikipedia.org/wiki/Afgar
47,Africana,1934,Broadway,Donald Heyward,Heyward,Heyward,,
48,After the Ball,1953,West End,Noël Coward,Coward,Coward,"Based on Oscar Wilde's play, Lady Windermere's Fan.",https://en.wikipedia.org/wiki/After_the_Ball_(musical)
49,Aida,2000,Broadway,Elton John,Tim Rice,"Linda Woolverton, Robert Falls and David Henry Hwang",,https://en.wikipedia.org/wiki/Aida_(musical)
50,Ain't Misbehavin',1978,Broadway revue,Various Artists,Various Artists,"Murray Horwitz and Richard Maltby, Jr.",,https://en.wikipedia.org/wiki/Ain%27t_Misbehavin%27_(musical)
51,Ain't Supposed to Die a Natural Death,1971,Broadway,Melvin Van Peebles,Van Peebles,Van Peebles,,https://en.wikipedia.org/wiki/Ain%27t_Supposed_to_Die_a_Natural_Death
52,Aladdin,1958,Television musical,Cole Porter,Porter,S. J. Perelman,,https://en.wikipedia.org/wiki/Aladdin_(TV_special)
53,"Aladdin

+ film (1992)

",2014,Broadway,Alan Menken,"Howard Ashman, Chad Beguelin and Tim Rice",Beguelin,"Based on the film of the same name. Notable Songs: ""A Whole New World"" and ""Friend Like Me"".",https://en.wikipedia.org/wiki/Aladdin_(2011_musical)
54,Ali Baba fr:Les 1001 Vies d'Ali Baba,2000,French musical,Fabrice Aboulker and Alain Lanty,Thibaut Chatel and Frédéric Doll,,,
55,Alice in Wonderland,1951,Animated film,Bob Hilliard and Sammy Fain,Hilliard and Fain,Winston Hibler and Ted Sears,,https://en.wikipedia.org/wiki/Alice_in_Wonderland_(1951_film)
56,Alice in Wonderland: An X-Rated Musical Comedy,1976,"Adult film
(Off-Broadway; 2007)",Jack Stern,Jack Stern,Bill Osco,Based on Lewis Carroll's book Alice's Adventures in Wonderland.,https://en.wikipedia.org/wiki/Alice_in_Wonderland_(1976_film)
57,Alice's Adventures in Wonderland,1972,Musical film,John Barry,Barry,William Sterling,,https://en.wikipedia.org/wiki/Alice%27s_Adventures_in_Wonderland_(1972_film)
58,Alice with Kisses,1964,Off-Broadway,,,,,
59,Alive and Kicking,1950,Broadway revue,Hoagy Carmichael et al.,Paul Francis Webster et al.,I. A. L. Diamond,,https://en.wikipedia.org/wiki/Alive_and_Kicking_(musical)
60,All 4 One,2001,Off-West End,John Trent Wallace,Kevin John Heuston,Heuston,,
61,All Aboard,1913,Broadway,E. Ray Goetz and Malvin M. Franklin,Goetz,Mark Swan,,
62,All American,1962,Broadway,Charles Strouse,Lee Adams,Mel Brooks,,https://en.wikipedia.org/wiki/All_American_(musical)
63,All Hands on Deck,1961,Musical film,Cyril Mockridge,Donald R. Morris,Jay Sommers,,https://en.wikipedia.org/wiki/All_Hands_on_Deck_(film)
64,All in Fun,1940,Broadway revue,Baldwin Bergerson and John Rox,,,,
65,All in Love,1961,Off-Broadway,Jacques Urbont,Bruce Geller,Geller,,
66,All Shook Up,2005,Broadway Jukebox musical,Elvis Presley,Various artists,Joe DiPietro,,https://en.wikipedia.org/wiki/All_Shook_Up_(musical)
67,All That Jazz,1979,Musical film,Ralph Burns,Various artists,Robert Alan Aurthur and Bob Fosse,,https://en.wikipedia.org/wiki/All_That_Jazz_(film)
68,All the Fun of the Fair,2008,West End,Ian Wherry,,Jon Conway,David Essex Jukebox musical,https://en.wikipedia.org/wiki/All_the_Fun_of_the_Fair
69,All the King's Horses,1935,Musical film,Edward Horan,Horan,"Edmund H. North, Frank Tuttle and Frederick Stephani","All the King's Horses by Lawrence Clark, Max Giersberg, Frederik Herendeen and Edward Horan",https://en.wikipedia.org/wiki/All_the_King%27s_Horses_(1935_film)
70,Allegiance,2012,Broadway,Jay Kuo,Jay Kuo,"Marc Acito, Jay Kuo, Lorenzo Thione","Regional Premiere 2012, Broadway 2015",
71,Allegro,1947,Broadway,Richard Rodgers,Oscar Hammerstein II,Hammerstein II,,https://en.wikipedia.org/wiki/Allegro_(musical)
72,An Alligator Named Daisy,1955,Musical film,"Stanley Black and Sam Coslow, et al.",,Jack Davies,,https://en.wikipedia.org/wiki/An_Alligator_Named_Daisy
73,"Alma, Where Do You Live?",1910,Broadway,Jean Briquet,George V. Hobart,Hobart,,
74,Alone at Last,1914,Broadway,Franz Lehár et al.,Matthew Woodward et al.,,,
75,Along Fifth Avenue,1949,Broadway revue,Gordon Jenkins et al.,Tom Adair et al.,,,
76,Altar Boyz,2005,Off-Broadway,Gary Adler and Michael Patrick Walker,Adler and Walker,Kevin Del Aguila,,https://en.wikipedia.org/wiki/Altar_Boyz
77,Amazing Grace,2012,Broadway,Christopher Smith,Christopher Smith,"Christopher Smith, Arthur Giron",Regional Premiere 2012. Broadway 2015,
78,Ambassador,1972,Broadway,Don Gohman,Hal Hackady,Don Ettlinger and Anna Marie Barlow,,https://en.wikipedia.org/wiki/Ambassador_(musical)
79,Amen Corner,1983,Broadway,Garry Sherman,Peter Udell,Philip Rose and Peter Udell,,https://en.wikipedia.org/wiki/Amen_Corner_(musical)
80,Amélie,2017,Broadway,Daniel Messé,Daniel Messé and Nathan Tyson,Craig Lucas,Based on the 2001 romantic comedy of the same name,https://en.wikipedia.org/wiki/Am%C3%A9lie
81,America Kicks Up Its Heels,1983,Off-Broadway,William Finn,Finn,Charles Rubin,,
82,The American Astronaut,2001,Musical film,Billy Nayer Show,Nayer Show,Cory McAbee,,https://en.wikipedia.org/wiki/The_American_Astronaut
83,American Idiot,2010,Broadway,Green Day,Billie Joe Armstrong,Armstrong and Michael Mayer,,https://en.wikipedia.org/wiki/American_Idiot_(musical)
84,American Pop,1981,Animated film,Lee Holdridge,Various artists,Ronni Kern,Paralleling the history of American popular music.,https://en.wikipedia.org/wiki/American_Pop
85,An American in Paris,1951,Musical film,George Gershwin,Ira Gershwin,Alan Jay Lerner,,https://en.wikipedia.org/wiki/An_American_in_Paris_(film)
86,An American in Paris,2015,Broadway,George Gershwin,Ira Gershwin,Craig Lucas,Based on 1951 musical film of the same name,https://en.wikipedia.org/wiki/An_American_in_Paris_(film)
87,America's Sweetheart,1931,Broadway,Richard Rodgers,Lorenz Hart,Herbert Fields,,https://en.wikipedia.org/wiki/America%27s_Sweetheart_(musical)
88,The Amorous Flea,1964,Off-Broadway,Bruce Montgomery,Montgomery,Jerry Devine,,https://en.wikipedia.org/wiki/The_Amorous_Flea
89,Amour,2002,Broadway,Michel Legrand,Didier Van Cauwelaert,Jeremy Sams,,https://en.wikipedia.org/wiki/Amour_(musical)
90,Amphitryon,1935,Musical film,Franz Doelle,C. Amberg and Bruno Balz,Reinhold Schünzel,"Based on the stage play Amphytrion by Molière, Titus Maccius Plautus and Heinrich von Kleist",https://en.wikipedia.org/wiki/Amphitryon_(film)
91,An Arabian Girl and 40 Thieves,1899,Broadway,"W. H. Batchelor, John J. Braham, Jessie Williams and Meyer Lutz",J. Cheever Goodwin,,,
92,Anastasia,1997,Animated film,Stephen Flaherty,Lynn Ahrens,"Susan Gauthier, Bruce Graham, Bob Tzudiker, Noni White and Eric Tuchman",,https://en.wikipedia.org/wiki/Anastasia_(1997_film)
93,Anastasia,2017,Broadway,Stephen Flaherty,Lynn Ahrens,Terrence McNally,Based on 1997 animated musical film of the same name,https://en.wikipedia.org/wiki/Anastasia_(1997_film)
94,Anchors Aweigh,1945,Musical film,Georgie Stoll,Various artists,Natalie Marcin,,https://en.wikipedia.org/wiki/Anchors_Aweigh_(film)
95,And the Angels Sing,1944,Musical film,Victor Young,Various Artists,"Claude Binyon, Melvin Frank and Norman Panama",,https://en.wikipedia.org/wiki/And_the_Angels_Sing
96,And the World Goes 'Round,1991,Off-Broadway revue,John Kander,Fred Ebb,N/A,,https://en.wikipedia.org/wiki/And_the_World_Goes_%27Round
97,André Charlot's Revue of 1924,1924,Revue,Various artists,Various artists,N/A,,
98,Andy Hardy's Private Secretary,1941,Musical film,,,,,https://en.wikipedia.org/wiki/Andy_Hardy%27s_Private_Secretary
99,Angel,1978,Broadway,Gary Geld,Peter Udell,Udell and Ketti Frings,,https://en.wikipedia.org/wiki/Angel_(musical)
100,Angel in the Wings,1947,Revue,Bob Hilliard and Carl Sigman,Hilliard and Sigman,,,https://en.wikipedia.org/wiki/Angel_in_the_Wings
101,Angelika,2007,Czech musical,,,,,https://en.wikipedia.org/wiki/Angelique_(novel_series)
102,"Angélique, Marquise des Anges",1995,French musical,,,,,https://en.wikipedia.org/wiki/Angelique_(novel_series)
103,Angry Housewives,1983,Off-Broadway,Chad Henry and A.M. Collins,Henry and Collins,,,
104,Ani: A Parody,2014,Off-Broadway,Matt and Nick Lang with music and lyrics by Clark Baxtresser & Pierce Siebers,,,,https://en.wikipedia.org/wiki/Ani_(musical)
105,Animal Crackers,1928,Broadway,Bert Kalmar and Harry Ruby,Kalmar and Ruby,George S. Kaufman and Morrie Ryskind,,https://en.wikipedia.org/wiki/Animal_Crackers_(musical)
106,Ankles Aweigh,1955,Broadway,Sammy Fain,Dan Shapiro,Guy Bolton and Eddie Davis,,https://en.wikipedia.org/wiki/Ankles_Aweigh
107,Anne & Gilbert,2005,Canadian musical,"Jeff Hochhauser, Nancy White and Bob Johnston","Hochhauser, White and Johnston","Hochhauser, White and Johnston","Based on Lucy Maud Montgomery's novels, Anne of Avonlea and Anne of the Island.",https://en.wikipedia.org/wiki/Anne_%26_Gilbert
108,Anne of Green Gables,1965,Canadian musical,Norman Campbell,"Don Harron, Campbell, Elaine Campbell and Mavor Moore",Harron,"Based on Lucy Maud Montgomery's novel, Anne of Green Gables.",https://en.wikipedia.org/wiki/Anne_of_Green_Gables:_The_Musical
109,"Annie

+ film (1982)
+ film (1999)
+ film (2014)

",1977,Broadway,Charles Strouse,Martin Charnin,Thomas Meehan,"Notable songs: ""Tomorrow"" and ""A Hard-Knock Life"".",https://en.wikipedia.org/wiki/Annie_(musical)
110,"Annie Get Your Gun

+ film (1950)

",1946,Broadway,Irving Berlin,Berlin,Herbert Fields and Dorothy Fields,"Notable song: ""There's No Business Like Show Business"".",https://en.wikipedia.org/wiki/Annie_Get_Your_Gun_(musical)
111,Annie Warbucks,1993,Off-Broadway,Charles Strouse,Martin Charnin,Thomas Meehan,Sequel to Annie.,https://en.wikipedia.org/wiki/Annie_Warbucks
112,Anya,1965,Broadway,Robert Wright and George Forrest,Wright and Forrest,George Abbott and Guy Bolton,,https://en.wikipedia.org/wiki/Anya_(musical)
113,Anyone Can Whistle,1964,Broadway,Stephen Sondheim,Sondheim,Arthur Laurents,,https://en.wikipedia.org/wiki/Anyone_Can_Whistle
114,Anything Goes,1934,Broadway,Cole Porter,Porter,Guy Bolton and P. G. Wodehouse,"Notable songs: ""Anything Goes"", ""You're the Top"" and ""I Get a Kick out of You"".",https://en.wikipedia.org/wiki/Anything_Goes
115,Applause,1970,Broadway,Charles Strouse,Lee Adams,Betty Comden and Adolph Green,,https://en.wikipedia.org/wiki/Applause_(musical)
116,Apple Blossoms,1919,,,,,,
117,The Apple Tree,1966,Broadway,Jerry Bock,Sheldon Harnick,"Bock, Harnick and Jerome Coopersmith",,https://en.wikipedia.org/wiki/The_Apple_Tree
118,April in Paris,1952,Musical film,Vernon Duke and LeRoy Prinz,Various artists,Jack Rose,,https://en.wikipedia.org/wiki/April_in_Paris_(film)
119,April Love,1957,Musical film,Sammy Fain and Alfred Newman,Various artists,George Agnew,,https://en.wikipedia.org/wiki/April_Love_(film)
120,Arabian Nights,1954,Off-Broadway,Carmen Lombardo and John Jacob Lœb,Lombardo and Lœb,,,
121,The Ark,1998,Off-Broadway,Michael McLean,McLean and Kevin Kelly,McLean and Kelly,,
122,The Arcadians,1909,West End,Lionel Monckton and Howard Talbot,Arthur Wimperis,Mark Ambient and Alexander M. Thompson,,https://en.wikipedia.org/wiki/The_Arcadians_(musical)
123,Are You With It?,1945,Broadway,Harry Revel,Arnold B. Horwitt,Sam Perrin and George Balzer,"Based on the novel, Slightly Perfect by George Malcolm-Smith.",https://en.wikipedia.org/wiki/Are_You_with_It%3F_(musical)
124,Argentine Nights,1940,Musical film,Frank Skinner,Various artists,J. Robert Bren and Gladys Atwater,,
125,Ari,1971,Mark Hellinger Theatre,Walt Smith,Leon Uris,"Based on the novel, Exodus (Uris novel) by Leon Uris.",,
126,The Aristocats,1970,Animated film,George Bruns,Various Artists,"Ken Anderson, Larry Clemmons, Eric Cleworth, Vance Garry, Julius Svendsen, Frank Thomas, and Ralph Wright",Based on characters created by Tom McGowan and Tom Rowe,https://en.wikipedia.org/wiki/The_Aristocats
127,Arms and the Girl,1950,Broadway,Morton Gould,Dorothy Fields,Herbert Fields and Fields,,
128,Around the World,1946,Broadway,Cole Porter,Porter,Orson Welles,,https://en.wikipedia.org/wiki/Around_the_World_(musical)
129,Arthur! Arthur!,1969,Musical film,Harry Robertson,Various artists,Julian Symons,A musical retelling of Dudley Moore's Arthur films.,https://en.wikipedia.org/wiki/Arthur!_Arthur!
130,Artists and Models,1955,Musical film,Harry Warren and Jack Brooks,Various Artists,"Frank Tashlin, Herbert Baker, and Hal Kanter","Notable song: ""Innamorata"".",https://en.wikipedia.org/wiki/Artists_and_Models
131,As Long as They're Happy,1954,Musical film,Stanley Black,Alan Melville,Melville,,https://en.wikipedia.org/wiki/As_Long_as_They%27re_Happy
132,As the Girls Go,1948,Broadway,Jimmy McHugh,Harold Adamson,William Roos,,https://en.wikipedia.org/wiki/As_the_Girls_Go
133,As Thousands Cheer,1933,Broadway,Irving Berlin,Berlin,Moss Hart,,https://en.wikipedia.org/wiki/As_Thousands_Cheer
134,Aspects of Love,1990,West End,Andrew Lloyd Webber,Don Black and Charles Hart,Lloyd Webber,"Notable song: ""Love Changes Everything"".",https://en.wikipedia.org/wiki/Aspects_of_Love
135,Assassins,1990,Off-Broadway,Stephen Sondheim,Sondheim,John Weidman,Premiered on Broadway in 2004.,https://en.wikipedia.org/wiki/Assassins_(musical)
136,At Home Abroad,1935,Broadway revue,Arthur Schwartz,Howard Dietz,N/A,,https://en.wikipedia.org/wiki/At_Home_Abroad
137,At Long Last Love,1975,Musical film,Cole Porter,Porter,Peter Bogdanovich,,https://en.wikipedia.org/wiki/At_Long_Last_Love
138,At the Circus,1939,Musical film,Harold Arlen,Arlen,Irving Brecher,,https://en.wikipedia.org/wiki/At_the_Circus
139,At the Drop of a Hat,1956,Off-West End revue,Donald Swann,Michael Flanders,Swann and Flanders,Produced on Broadway in 1959.,https://en.wikipedia.org/wiki/At_the_Drop_of_a_Hat
140,At the Drop of Another Hat,1963,Off-West End revue,Donald Swann,Michael Flanders,Swann and Flanders,Produced on Broadway in 1966.,https://en.wikipedia.org/wiki/At_the_Drop_of_Another_Hat
141,At War with the Army,1950,Musical film,Joseph J. Lilley,Lilley,James Allardice and Fred Finklehoffe,,https://en.wikipedia.org/wiki/At_War_with_the_Army
142,Athena,1954,Musical Film,Hugh Martin and Ralph Blane,Martin and Blane,William Ludwig and Leonard Spigelgass,,https://en.wikipedia.org/wiki/Athena_(film)
143,The Athenian Touch,1964,Off-Broadway,Willard Straight,David Eddy,J. Albert Fracht and Arthur Goodman,,
144,Aunt Sally,1933,Musical film,Harry M. Woods,Woods,Guy Bolton,,
145,Autant en emporte le vent,2003,French musical,Gérard Presgurvic,Presgurvic,,Based on the novel Gone with the Wind,https://en.wikipedia.org/wiki/Autant_en_emporte_le_vent
146,Avenue Q,2003,Broadway,Robert Lopez and Jeff Marx,Lopez and Marx,Jeff Whitty,"Notable songs: ""It Sucks to Be Me"", ""Everyone's a Little Bit Racist"" and ""There's a Fine, Fine Line"".",https://en.wikipedia.org/wiki/Avenue_Q
147,Babes in Arms,1937,Broadway,Richard Rodgers,Lorenz Hart,Rodgers and Hart,"Notable songs: ""Where or When"", ""My Funny Valentine"", ""The Lady Is a Tramp"", ""Johnny One Note"" and ""I Wish I Were in Love Again"".",https://en.wikipedia.org/wiki/Babes_in_Arms
148,Babes in Toyland,1903,Broadway,Victor Herbert,Glen MacDonough,MacDonough,,https://en.wikipedia.org/wiki/Babes_in_Toyland_(operetta)
149,Babes on Broadway,1941,Musical film,Burton Lane and Roger Edens,E.Y. Harburg and Ralph Freed,,,https://en.wikipedia.org/wiki/Babes_on_Broadway
150,Babette,1903,Broadway,Victor Herbert,Harry B. Smith,Smith,,
151,Baby,1983,Broadway,David Shire,"Richard Maltby, Jr.",Sybille Pearson,,https://en.wikipedia.org/wiki/Baby_(musical)
152,Baby It's You!,2011,Broadway,Various Artists,Various Artists,Floyd Mutrox and Colin Escott,,https://en.wikipedia.org/wiki/Baby_It%27s_You!
153,Baby Talk (Musical),2000,Neuköllner Opera,Thomas Zaufke,Peter Lund,,Das Kinder-Krieg Musical,https://en.wikipedia.org/w/index.php?title=Baby_Talk_(Musical)&action=edit&redlink=1
154,Bad Girls: The Musical,2006,West End,Kath Gotts,Gotts,Maureen Chadwick and Ann McManus,Based on the ITV1 television series Bad Girls.,https://en.wikipedia.org/wiki/Bad_Girls:_The_Musical
155,Back to the 80's,2004,Australian musical,Neil Gooding,Gooding,Gooding,,https://en.wikipedia.org/wiki/Back_to_the_80s_(musical)
156,Bad Habits of 1926,1926,Broadway revue,Manning Sherwin,"Arthur Herzog, Jr.",N/A,,
157,Bajour,1964,Broadway,Walter Marks,Marks,Ernest Kinoy,"Based on Joseph Mitchell's short stories, The Gypsy Women and The King of the Gypsies.",https://en.wikipedia.org/wiki/Bajour_(musical)
158,Baker Street,1965,Broadway,"Marian Grudeff, Raymond Jessel and Jerry Bock","Grudeff, Jessel and Sheldon Harnick",Jerome Coopersmith,,https://en.wikipedia.org/wiki/Baker_Street_(musical)
159,The Baker's Wife,1989,West End,Stephen Schwartz,Schwartz,Joseph Stein,"Aimed at a Broadway run in 1976, but closed during try-outs.",https://en.wikipedia.org/wiki/The_Baker%27s_Wife
160,The Balkan Princess,1910,West End,Paul Rubens,Rubens and Arthur Wimperis,Frederick Lonsdale and Frank Curzon,,https://en.wikipedia.org/wiki/The_Balkan_Princess
161,Ball im Savoy,1932,German operetta,Paul Abraham,Alfred Grünwald and Fritz Löhner-Beda,Abraham,,https://en.wikipedia.org/wiki/Ball_im_Savoy
162,Ballad for Bimshire,1963,Off-Broadway,Irving Burgie,Burgie,Burgie and Loften Mitchell,,
163,Ballroom,1978,Broadway,Billy Goldenberg,Alan Bergman and Marilyn Bergman,Jerome Kass,,https://en.wikipedia.org/wiki/Ballroom_(musical)
164,Bambi,1942,Animated film,Frank Churchill and Edward H. Plumb,Churchill and Plumb,Larry Morey,,https://en.wikipedia.org/wiki/Bambi
165,Band Geeks,2014,Off-Off-Broadway,Tommy Newman and Mark Allen,Newman and Gaby Alter,Alter,,https://en.wikipedia.org/w/index.php?title=Band_Geeks_(musical)&action=edit&redlink=1
166,Band Waggon,1940,Musical film,Various artists,Various artists,,,https://en.wikipedia.org/wiki/Band_Waggon_(film)
167,The Band Wagon,1931,Broadway revue,Arthur Schwartz,Howard Dietz,N/A,"Notable songs: ""I Love Louisa"", ""Hoops"" and ""Dancing in the Dark"".",https://en.wikipedia.org/wiki/The_Band_Wagon
168,Bandanna Land,1908,Broadway,Will Marion Cook,Jesse A. Shipp and Alex Rogers,Shipp and Rogers,,
169,Banjo Eyes,1941,Broadway,Vernon Duke,John La Touche and Harold Adamson,Joseph Quinlan and Izzy Ellinson,,https://en.wikipedia.org/wiki/Banjo_Eyes
170,Bar Mitzvah Boy,1978,West End,Jule Styne,Don Black,Jack Rosenthal,,https://en.wikipedia.org/wiki/Bar_Mitzvah_Boy_(musical)
171,Barbarella,2004,Austrian musical,Dave Stewart,Stewart,Stewart,Based on the 1968 film.,https://en.wikipedia.org/wiki/Barbarella_(musical)
172,Bare: A Pop Opera,2000,Off-Broadway,Damon Intrabartolo,"Jon Hartmere, Jr.","Intrabartolo and Hartmere, Jr.","Notable song: ""Portrait of a Girl"".",https://en.wikipedia.org/wiki/Bare:_A_Pop_Opera
173,Bare Facts of 1926,1926,Broadway revue,Charles M. Schwab,Henry Myers,Stuart Hamill,,
174,Barefoot Boy with Cheek,1947,Broadway,Sidney Lippman,Sylvia Dee,Max Shulman,,
